{
  "locale": "cs-CZ",
  "translation_group": "al-dente",
  "translation_status": "published",
  "title": "Al dente",
  "slug": "al-dente",
  "category": "Kuchařské techniky",
  "short_definition": "Stupeň uvaření těstovin či rýže „na skus“, kdy si zachovávají mírný odpor.",
  "detailed": "Al dente doslova znamená „na zub“. Těstoviny uvařené al dente kladou při skusu jemný odpor a mají ve středu ještě nepatrně světlejší jádro. Přesnou dobu vždy určuje obal – ochutnávejte cca minutu před uplynutím uvedeného času.",
  "origin_country": "IT",
  "taste": "",
  "usage": "Platí především pro těstoviny a rýži (např. risotto), kde se vaření zastavuje v okamžiku, kdy je surovina hotová, ale ještě má strukturu.",
  "substitute": "",
  "related_recipes": ["spaghetti-carbonara"],
  "related_countries": ["IT"],
  "seo_title": "Al dente – co to znamená | Kuchařský slovníček Atlas chutí",
  "meta_description": "Vysvětlení pojmu al dente: jak poznat správně uvařené těstoviny a rýži.",
  "status": "publish"
}
